character	speech_id	text
TITLES	1	
OLD MAN	2	Bloody kids.
EXT. DARKNESS	3	The old man is wandering up to the house carrying a lit torch.
WORMTAIL	4	Oh no no no my Lord Voldemort. I only meant... perhaps if we were to do it without the boy..
VOLDEMORT	5	NO! The boy is everything, it cannot
UNKNOWN MAN	6	I will not disappoint you my lord.
VOLDEMORT	7	Good. First, gather our old comrades.
VOLDEMORT	8	Nagini tells me the old caretaker is standing outside the door.
VOLDEMORT	9	Step aside so I can give our guest a proper greeting.  A loud spell is cast and Harry wakes up in a flash of panic.
HERMIONE	10	Harry!
HERMIONE	11	Are you alright?
HARRY	12	Hermione. Bad dream. When did you get here?
HERMIONE	13	Just now. You?
HARRY	14	Last night.
HERMIONE	15	Wake up. Wake up Ronald!
RON	16	Bloody hell.
HERMIONE	17	Honestly. Get dressed, and don't go back to sleep. Come on Ron! Your mother says breakfast's ready.
EXT. GRASSLAND	18	
HARRY	19	Where are we actually going?
RON	20	Don't know. Hey Dad! Where are we going?
ARTHUR	21	Haven't the foggiest, keep up!
AMOS	22	Arthur! It's about time son.
ARTHUR	23	Sorry Amos. Some of us had a bit of a sleepy start. This is Amos Diggory
CEDRIC	24	Yes sir.
AMOS	25	Merlin's beard, you must be Harry Potter.
HARRY	26	Yes sir. This way.
AMOS	27	Great great pleasure.
HARRY	28	Pleasure to meet you too sir.
ARTHUR	29	That's it sir, just over there.
AMOS	30	Shall we? We don't want to be late.   Camera homes in on a boot on top of the hillside.
FRED	31	That isn't just any old manky boot mate.
GEORGE	32	It's a portkey.
AMOS	33	Time to go. Ready?
HARRY	34	What's a 'portkey'?
AMOS	35	After 3. One... Two...
ARTHUR	36	Harry!
AMOS	37	Three!  There's a white flash and suddenly they're all flying through the air. Everyone cheers.
ARTHUR	38	Let go kids!
HERMIONE	39	What??
ARTHUR	40	Let! Go!  Harry, Hermione and the young Weasleys crash to the ground with a thump. Arthur, Amos and Cedric come down more gracefully.
ARTHUR	41	I bet that cleared your sinuses eh?
HARRY	42	Thanks.  They walk across the field and we see there's a massive crowd gathered and cheering, tents are set up all over.
ARTHUR	43	Well kids, welcome to the Quidditch World Cup!
AMOS	44	Parting of the waves I think old chap, see you at the match.  Amos and Cedric separate and walk off.
HARRY	45	See ya later Cedric.
ARTHUR	46	Home sweet home.
ARTHUR	47	Girls. Choose a bunk and unpack. Ron, get out of the kitchen we're all hungry.
TWINS	48	Yeah get out of the kitchen Ron.
ARTHUR	49	Feet off the table.
TWINS	50	Feet off the table.
EXT. HILLSIDE	51	We pan up the hillside onto a large stadium which seems to have a huge number of floors.
RON	52	Blimey Dad, how far up ARE we?
LUCIUS	53	Well put it this way, if it rains... you'll be the first to know
DRACO	54	Father and I are in the minister's box, by personal invitation of Cornelius
LUCIUS	55	Don't boast Draco. There's no need with these people. Do enjoy yourself won't you. While you can.  The ceremonies begin. Balloons fly and fireworks go off.
ARTHUR	56	Come on up, take your seats. I told you these seats would be worth waiting for.
GEORGE	57	Come on!
FRED	58	It's the Irish!
GEORGE	59	Here come the Bulgarians!
WEASLEYS	60	Krum!!!
GEORGE	61	Yes!
ANNOUNCER	62	Good evening! It gives me great pleasure to welcome each and every one of you to the final of the 422nd Quidditch World Cup. Let the match begin!
RON	63	There's no one like Krum. He's like
GINNY	64	Think you're in love Ron?
BOYS	65	When we're apart my heart beats only for youuu!
ARTHUR	66	Stop! Stop it. It's not the irish. We've gotta get out of here. Now.
EXT. OUTSIDE THE TENT	67	
ARTHUR	68	Get back to the portkey everybody, and stick together. Fred, George... Ginny is your responsibility.  Some figures in pointed hoods carrying flaming torches are walking across the campsite chanting ominous noises. The crowd is paniced and rushing all over. Harry is trampled unconscious.
RON	69	Been looking for you for ages. Thought we lost you.
HARRY	70	What is THAT?
ARTHUR	71	Stop! That's my son.  Arthur and others approach.
ARTHUR	72	Ron, Harry, Hermione are you alright?
BARTY	73	Which of you conjured this?
ARTHUR	74	You can't possibly..
BARTY	75	Do not lie! You have been discovered at the scene of the crime!
HARRY	76	Crime?
ARTHUR	77	Barty, they're just kids.
HARRY	78	What crime?
HARRY	79	Those people tonight, in the masks...
BARTY	80	Follow me.
HARRY	81	There was a man. Before. There.
BARTY	82	All of you, this way.
ARTHUR	83	Harry, who?
HARRY	84	I dunno. I didn't see his face.
LADY OFFSCREEN	85	Anything from the trolley? Anything from the trolley?
LADY	86	Anything from the trolley dears?
RON	87	Packet of drewbals and a liquorice wand.
RON	88	On second thought, just the drewbals.
HARRY	89	It's alright I'll get it.
RON	90	Just the drewbals, thanks.
CHO	91	Two pumpkin pasties please.
CHO	92	Thank you.
LADY	93	Anything sweet for you dear?
HARRY	94	Oh no thank you I'm not hungry.
HERMIONE	95	This is horrible, how can the ministry not know who conjured it. Isn't there any security or?
RON	96	Loads according to Dad, that's what
HERMIONE	97	It's hurting again isn't it, your scar.
HARRY	98	I'm fine.
HERMIONE	99	You know Sirius will want to hear about this. What you saw at the world cup, and the dream.
EXT. HOGWARTS	100	We see four flying horses flying through the air pulling a carriage coming in to land at Hogwarts. The crowds cheer.
HAGRID	101	Clear the runway.
HARRY	102	Well there's something you don't see every day.  A large ship emerges from under the water and approaches too.
DUMBLEDORE	103	Now we're all settled in and sorted, I'd like to make an announcement. This castle will not only be your home this year but home to some very special guests as well. You see Hogwarts has been choosen...
DUMBLEDORE	104	So Hogwarts has been choosen to host a legendary event. The Tri-Wizard tournament. Now for those of you who do not know, the tri-wizard tournament brings together three schools for a series of magical contests. From each school a single contestant is selected to compete. Now let me be clear, if choosen you stand alone. And trust me when I say these contests are not for the faint hearted, but more of that later. For now please join me in welcoming the lovely ladies of the Beauxbatons Academy of magic
STUDENT	105	Blimey, that's one big woman.
DUMBLEDORE	106	And now our friends from the north, please greet the proud sons of Durmstrang and the high master Igor Karkaroff.   A series of older boys walk up the aisle brandishing bo staffs,
IGOR	107	Albus!
DUMBLEDORE	108	Igor.
MADAME MAXIME	109	Professor Dumbledore, my horses have
DUMBLEDORE	110	Not to worry Madame Maxime, our gamekeeper Hagrid's more than capable of seeing
MADAME MAXIME	111	But you know Monsieur Hagrid, they drink only single malt whiskey.  The man seated next to Hagrid yelps. Hagrid has stabbed a fork
MAN	112	You idiot!
DUMBLEDORE	113	Your attention please! I would like to say a few words. Eternal glory, that is what awaits the student who wins the tri-wizard tournament. But to do this that student must survive three tasks. Three extremely dangerous tasks.
FRED	114	Wicked.
DUMBLEDORE	115	For this reason the ministry has seen fit to impose a new rule. To explain all this we have the head of the department of international magic cooperation Mister Bartimus Crouch.  Thunder roars overhead, rain begins leaking through the roof
RON	116	Bloody hell, it's Mad-Eye Moody.
DUMBLEDORE	117	My dear old friend, thanks for coming.   MAD-EYE That stupid roof.  Mad-Eye takes a drink.
PUPIL	118	What's that he's drinking do you suppose?
HARRY	119	I don't know but I don't think it's Pumpkin Juice.
BARTY	120	After much deliberation the ministry
GEORGE	121	That's rubbish! You don't know what you're doing!
DUMBLEDORE	122	Silence!  Dumbledore casts magic over a box which melds into a goblet containing a blue flame.
DUMBLEDORE	123	The goblet of fire. Anyone wishing to submit themselves for the tournament
HERMIONE	124	Three sir.  MAD-EYE
PUPIL	125	Aw no way, the old codger can see out
RON	126	Yes...  MAD-EYE Give us a curse.
RON	127	Well, my dad did tell me about one... The imperious curse.  MAD-EYE Ahhh yes, your father would know all about that. Gave the ministry quite a bit of grief a few years ago. Perhaps this will show you why.  Mad-Eye pops open a jar with a spider in it.  MAD-EYE Hello. What a little beauty.
NEVILLE	128	There's the um... The cruciatus curse.   MAD-EYE Correct! Correct! come come. Particularly nasty. The torture curse.  Mad-Eye begins torturing the spider with magic, it squeals.
HERMIONE	129	Stop it! Can't you see it's bothering
HERMIONE	130	There's a reason those curses are unforgivable,
HERMIONE	131	Neville?
RON	132	Eternal glory, be brilliant wouldn't it? In three years from now we'll be
HARRY	133	Yeah well rather you than me.  The twins come up cheering.
GEORGE	134	Thank you thank you, well lads we've done it.
FRED	135	Cooked it up just this morning.
HERMIONE	136	It's not going to work.
FRED	137	Oh yeah? And why's that Granger.
HERMIONE	138	You see this? This is an age line. Dumbledore drew it himself.
FRED	139	So?
HERMIONE	140	So a genius like Dumbledore couldn't possibly be fooled by something pathetically dimwitted such as an age potion.
GEORGE	141	That's why it's so brilliant.
GEORGE	142	Ready Fred?
FRED	143	Ready George?
GEORGE	144	You said..
DUMBLEDORE	145	Sit down please. And now the moment you've all been waiting for, the champions selection!  Dumbledore approaches the blue flame and it glows red. A name comes out. Everyone looks on anxiously.
DUMBLEDORE	146	The Durmstrang champion is ... Viktor Krum!  The Durmstrang crowd cheer. Another name comes out.
DUMBLEDORE	147	The champion from Beauxbatons... Fleur Delacour  The Beauxbatons girls cheer as Fleur walks up. Another name comes out.
DUMBLEDORE	148	The Hogwarts champion... Cedric Diggory.   Hogwarts pupils cheer as Cedric takes the stage.
DUMBLEDORE	149	Excellent! we now have our three champions! But in the end only one will go down in history. Only one will hoist this chalice of champions, this vessel of victory the tri-wizard cup!  People cheer, but the goblet glows red once more and another name flies out. Dumbledore takes it and reads...
HAGRID	150	No... No.
HERMIONE	151	Go on Harry. Harry for goodness sake.
VOICE	152	He's a cheat! He's not even seventeen yet.
DUMBLEDORE	153	Harry! Did you put your name in the goblet of fire?
HARRY	154	No sir.
DUMBLEDORE	155	Did you ask one of the older students to do it for you?
HARRY	156	No sir.
DUMBLEDORE	157	You're absolutely sure?
HARRY	158	Yes sir.
IGOR	159	You seem to have given this a fair bit of thought Mad-Eye.  MAD-EYE It was once my job to think as dark wizards do Karkaroff perhaps you remember?
DUMBLEDORE	160	That doesn't help Alastor. Leave this to you Barty.
BARTY	161	The rules are absolute, the goblet of fire constitutes a binding magical contract.
MCGONAGALL	162	This can't go on Albus. First the dark mark, now this?
DUMBLEDORE	163	What do you suggest Minerva?
MCGONAGALL	164	Put an end to it. Don't let Potter compete.
DUMBLEDORE	165	You heard Barty the rules are clear.
SEVERUS	166	Master I too find it difficult to believe this mere coincidence, if we are to truly discover the meaning of these events perhaps we should for the time
DUMBLEDORE	167	I agree with Severus. Alastor, keep an eye on Harry will you?  MAD-EYE I can do that.
RON	168	How did you do it?
RON	169	Never mind. Doesn't matter. You could have let your best friend know though.
HARRY	170	Let you know what?
RON	171	You know bloody well what.
HARRY	172	I didn't ask for this to happen Ron. Okay? You're being stupid.
RON	173	Yeah that's me, Ron Weasley... Harry Potter's stupid friend.
HARRY	174	I didn't put my name in that cup. I don't WANT eternal glory I just wanna be.. Look, I don't know what happened tonight and I don't know why, it just did ok.
RON	175	Piss off.
RITA	176	What a charismatic quartet. Hello!   The four tri-wizard champions are stood together in a group.
RITA	177	I'm Rita Skeeter, I write for the daily prophet. But of course you know that don't you. It's you we don't know, you're the news. What quirks lurk beneath those rosy cheeks? what mysteries do the muscles mask? does courage lie beneath those curls? In short, what makes a champion tick. Me, myself and I want to know. Not to mention my rabid readers. So, who's feeling up to sharing? Mmm? Shall we start with the youngest. Lovely.
RITA	178	This is cosy.
HARRY	179	It's a broomcupboard.
RITA	180	You should feel right at home then. Don't mind if I use the quill do you?
HARRY	181	Oh, no.
RITA	182	So Harry, here you sit, a mere boy of twelve..
HARRY	183	I'm fourteen.
RITA	184	...about to compete against three students. Not only vastly more emotionally mature than yourself but have mastered spells that you wouldn't attempt in your dizziest daydreams. Concerned?
HARRY	185	I dunno I haven't really thought about it.
RITA	186	Course you're not just any ordinary
HARRY	187	Fourteen.
RITA	188	The story's legend. Do you think it was the trauma of your past that made you so keen to enter such a dangerous tournament.
HARRY	189	No I didn't enter.
RITA	190	Course you didn't. Everyone loves a rebel Harry. (to the quill) Scratch that last. Speaking of your parents, were they alive, how do you think they'd feel? proud? or concerned that your attitude shows at best a pathological need for attention, at worst a psychotic deathwish.
HARRY	191	AGH!
HARRY	192	Sirius?  Harry picks up a newspaper, the headline reads "THE CHAMPIONS ARE SELECTED" and reads.
HARRY	193	Sirius?! How...
SIR	194	I don't have much time Harry so let me get straight to it. Did you or did you not put your name into the goblet of fire?
HARRY	195	No!
SIR	196	Shh... I had to ask. Now, tell me about this dream of yours. You mentioned Wormtail and Voldemort, but who was the third
HARRY	197	I dunno.
SIR	198	You didn't hear a name?
SIR	199	What was that?
HARRY	200	He wanted... me. I dunno why, but he was gonna use this man to get to me. I mean it was only a dream right?
SIR	201	Yes. It's just a dream. Look Harry, the deatheaters at the world cup, your name rising from that goblet these are not just coincidences. Hogwarts isn't safe any more.
HARRY	202	What are you saying?
SIR	203	I'm saying the devils are inside the
HARRY	204	Do you think one of them put my name in the goblet?
SIR	205	I haven't a clue who put your name in that goblet Harry but whoever did it is no friend to you. People die in this tournament.
HARRY	206	I'm not ready for this Sirius.
SIR	207	You don't have a choice.
HARRY	208	Someone's coming!
SIR	209	Keep your friends close Harry.
RON	210	Who you talking to?
HARRY	211	Who says I was talking to anyone.
RON	212	I heard voices.
HARRY	213	Maybe you're imagining things, wouldn't be the first time.
RON	214	You're probably just practicing for your next interview I expect.  Ron leaves. Harry goes to the fire again but Sirius is gone. The newspaper in the fire has the headline "TEENAGE TRAGEDY".
EXT. LAKESIDE	215	
NEVILLE	216	Amazing. Amazing.
HARRY	217	Neville! You're doing it again!
NEVILLE	218	Oh, right sorry.
NEVILLE	219	Moody gave it to me. That day we had tea.
HERMIONE	220	Ronald would like me to tell you that
HARRY	221	Is that right? Well.... what?
HERMIONE	222	Uhhh...
HERMIONE	223	Dean was told by Parvati that... Please don't ask me say it again. Hagrid's looking for you.
HARRY	224	Well you can tell Ronald...
HERMIONE	225	I'm NOT an owl!
HAGRID	226	Did you bring your father's cloak like I asked you?
HARRY	227	Yeah I brought the cloak. Hagrid where are we going?
HAGRID	228	You'll see soon enough. Pay attention this is important.
HARRY	229	What's with the flower? Hagrid have you combed your hair?
HAGRID	230	As a matter of fact I have. You might like to try the same thing now and again.   We hear animal noises. Madame Maxime calls out to Hagrid.
MADAME MAXIME	231	Hagrid?
HAGRID	232	Oh, the cloak. Put the cloak on.
HAGRID	233	Bonsoir Olympe.
MADAME MAXIME	234	Oh Hagrid. I thought you weren't coming, I thought perhaps... you had... forgotten me.
HAGRID	235	Couldn't forget you Olympe.
MADAME MAXIME	236	What is it you want to show me? When we spoke earlier you sounded so exhilirated.
HAGRID	237	You'll be glad you came. Trust me.   A dragon nearby gives a loud roar.
MADAME MAXIME	238	Ahh, c'est magnifique!  In an opening we see people are running about, dragons are roaring and breathing fire.
MADAME MAXIME	239	Can we get closer?
HARRY	240	Dragons? That's the first task? You're joking.
HAGRID	241	Come on Harry. They're seriously misunderstood creatures.  A huge flame fires up.
HAGRID	242	Although, I have to admit that horntail is a right nasty piece of work. Poor
HARRY	243	Thanks.
BOY	244	Like the badge?
HARRY	245	Excuse me..
CEDRIC	246	Alright.
HARRY	247	Dragons. That's the first task. They've got one for each of us.
CEDRIC	248	Are you serious? And Fleur and Krum,
HARRY	249	Yes.
CEDRIC	250	Right. Hey listen, about the badges.
HARRY	251	Don't worry about it.
RON	252	You think so?
HARRY	253	I know so.
RON	254	Anything else?
HARRY	255	Yeah. Stay away from me.
RON	256	Fine.
DRACO	257	Why so tense Potter? My father and I have a bet you see. I don't think you're gonna last ten minutes in this tournament. He disagrees. He thinks you won't last
FIVE.	258	
HARRY	259	I don't give a damn what you or your father thinks Malfoy. He's vile and cruel, and you're just pathetic.  Harry walks away and Draco angrily tries casting a spell. Mad-Eye appears and quickly turns Malfoy into a ferret.  MAD-EYE I'll teach you to cast when someone's back is turned.
MCGONAGALL	260	Professor Moody what are you doing?   MAD-EYE Teaching.
MCGONAGALL	261	Is that a student?  MAD-EYE Technically it's a ferret.
DRACO	262	My father will hear about this!  MAD-EYE Is that a threat!
MCGONAGALL	263	We never use transfigration as a punishment, surely Dumbledore told you that.  MAD-EYE
MCGONAGALL	264	Well you will do well to remember it.   MAD-EYE
HARRY	265	Oh... um... You know I just thought I'd...  MAD-EYE Sit. Listen to me Potter. Your pal Diggory,
HARRY	266	Um... I dunno.. I can fly. I mean I'm a fair flyer.  MAD-EYE Better than fair the way I heard it.
HARRY	267	But I'm not allowed a broom.  MAD-EYE You're allowed a wand.
HERMIONE	268	Pssst! Harry? Is that you?
HARRY	269	Yeah.
HERMIONE	270	How are you feeling? OK? The key is to concentrate. After that you just have to...
HARRY	271	Battle a dragon.
RITA	272	Young love! Ohh how.. stirring. If everything goes unfortunately today you might make the front page.
RITA	273	No matter. We've got what we wanted.   Rita leaves and Dumbledore enters.
DUMBLEDORE	274	Good day champions. Gather round please. Now you've waited, you've wondered and at last the moment has arrived. The moment only four of you can fully appreciate.
DUMBLEDORE	275	What are you doing here Miss Granger?
HERMIONE	276	Oh um.. Sorry I'll just go.
DUMBLEDORE	277	Barty. The bag.
BARTY	278	Champions, in a circle around me. Miss Delacour over here, Mr Krum, and Potter over here. Right. Miss Delacour, if you will...  Barty holds up a bag. Fleur takes out a little green dragon.
BARTY	279	The welsh green. Mr Krum...
BARTY	280	The chinese fireball. Oooooh.
BARTY	281	The swedish short-snout. Which leaves...
HARRY	282	The horntail...
BARTY	283	What's that boy?
HARRY	284	Nothing.
BARTY	285	The hungarian horntail. These represent very real dragons, each of which has been given a golden egg to protect. Your objective is simple, collect the egg. This you must do, for each egg contains a clue without which you cannot hope to proceed to the next task. Any questions?
DUMBLEDORE	286	Very well. Good luck champions. Mr Diggory the sound of the cannon...  The cannon fires immediately.  Transcribed by IMSDb.com
HERMIONE	287	Your wand harry! Your wand!
EXT. HOGWARTS SKY	288	
GEORGE	289	We knew you wouldn't die Harry.
FRED	290	Lose a leg.
GEORGE	291	Or an arm.
FRED	292	Pack it in altogether.
TWINS	293	NEVER!
SEAMUS	294	Go on Harry, what's the clue?  Seamus hands Harry the golden egg.
HARRY	295	Who wants me to open it? You want me to open it?
HARRY	296	What the bloody hell was that?
FRED	297	Alright everyone, go back to your knitting. This is gonna be uncomfortable enough without all you nosey sods listening in.
RON	298	I reckon you'd have to be barking mad to put your own name in the goblet of fire.
HARRY	299	Caught on have you. Took you long enough.
RON	300	Wasn't just me who thought you'd done it. Everyone was saying it behind your back.
HARRY	301	Brilliant. That makes me feel loads better.
RON	302	At least I warned you about the dragons.
RON	303	Oh no no, I did. Don't you remember? I told Hermione to tell you that Seamus told me that Parvati told Dean that
HARRY	304	Who could possibly figure that out? That's completely mental.
RON	305	Yeah it is isn't it. Suppose I was a bit distraught.
HERMIONE	306	Boys.
NIGEL	307	Parcel for you Mr Weasley.
RON	308	Thank you Nigel.
RON	309	Not now Nigel. Later. Go on.
RON	310	I told him I'd get him Harry's autograph. Oh look mum's sent me something. Mum sent me a dress??
HARRY	311	Well it does match your eyes. Is there a bonnet?
GINNY	312	I'm not wearing that it's ghastly.
RON	313	What are you on about?
HERMIONE	314	They're not for Ginny they're for you! Dress robes.
RON	315	Dress robes? for what?
MCGONAGALL	316	The yule ball has been a tradition of the tri-wizard tournament since its inception. On Christmas eve night we and our guests gather in the great hall for well mannered frivolity. As representitives of the host school I expect each and every one of you to put your best foot forward, and I mean this literally because the yule ball is first and foremost... a dance.  Groans emerge from the boys who are listening on. The girls seem a lot more excited.
MCGONAGALL	317	Silence. The house of Godrick Griffindore has commanded the respect of the wizard world for nearly ten centuries. I will not have you in the course of a single evening besmirching that name by behaving like a babbling, bumbling band of baboons.
MCGONAGALL	318	Inside every boy a lordly lion prepared to prance. Mr Weasly, will you join me.
MCGONAGALL	319	Now, place your right hand on my waist.
RON	320	Where?
MCGONAGALL	321	My waist.
MCGONAGALL	322	Now bend your arm. Mr Filch...  The music starts.
MCGONAGALL	323	One two three, one two three, one two three.
TWINS	324	Never.
MCGONAGALL	325	Everybody come together.  The girls instantly stand and walk forward, the boys are all still seated.
MCGONAGALL	326	Boys, on your feet.
RON	327	Blimey Harry, you slayed dragons. If you can't get a date who can?
HARRY	328	I think I'd take the dragon right now.
HAGRID	329	I take after my mum. Though I didn't know her very well, she left when I was about three. No, not the maternal sort her, broke my dad's heart though. You know he was a tiny little fellow my dad, I could pick him up with one
HAGRID	330	And then he died when I was still in school. So I had to make me own way as it were. But enough of me, what about you!
EXT. LAKESIDE	331	
RON	332	This is mad. At this rate we'll be the only ones in our year without dates.
RON	333	Well, us and Neville!
HERMIONE	334	It might interest you to know that Neville's already got someone.
RON	335	Now I'm really depressed.
RON	336	Well Hermione, you're a girl.
HERMIONE	337	Oh well spotted.
RON	338	Come on. It's one thing for a bloke to show up alone. For a girl it's just sad.
HERMIONE	339	I won't be going alone because believe it or not someone's asked me. And I said yes.
RON	340	Bloody hell.
RON	341	Look. We've just got to grit our teeth and do it. Tonight when we get back to the common room, we'll both have partners. Agreed?
HARRY	342	Agreed.
CHO	343	Harry!
HARRY	344	Cho!
CHO	345	Watch yourself on the stairs, it's a bit icey at the top.
HARRY	346	Ok thanks. Cho?
CHO	347	Yes?
HARRY	348	Um. (Mumbling) I just wondered if maybe you wanted to go to the ball with me?
CHO	349	Sorry? I didn't catch that.
HARRY	350	Um. I was just wondering if maybe you wanted to go to the ball with me.
CHO	351	Oh. Um. Harry I'm sorry but someone's already asked me. And well I've said
HARRY	352	Ok. Great. Fine. No problem. Good.
HARRY	353	What happened to you?
HERMIONE	354	What?
HERMIONE	355	No of course.
HARRY	356	Don't be silly.
RON	357	There she was walking by. You know I like it when they walk. I couldn't help it, it just sort of slipped out.
HARRY	358	What did you do then?
RON	359	What else? I ran for it. I'm not cut out for this Harry. I don't know what got into me.  The Patil twins walk past.
PATILS	360	Hi Harry.
HARRY	361	Hey!
ELSEWHERE	362	
RON	363	Bloody hell.
RON	364	What are those??
HARRY	365	My dress robes.
RON	366	Well they're alright. No lace, no dodgy little collar.
HARRY	367	Well I expect yours are more traditional.
RON	368	Traditional?? They're ancient! I look like my great aunt Tessie.
RON	369	I smell like my great aunt Tessie. Murder me Harry.
HARRY	370	Leave it alone.
HARRY	371	Who?
HARRY	372	Because we'd take the mickey out of
RON	373	Because nobody asked her. I would have
PARVATI	374	Hello boys. Don't you look...
PARVATI	375	... dashing.
MCGONAGALL	376	Here you are Potter. Are you and Miss Patil ready?
HARRY	377	Ready professor?
MCGONAGALL	378	To dance. It's traditional that the three champions or in this case four are the first to dance. Surely I told you that.
HARRY	379	No.
MCGONAGALL	380	Oh well now you know. Oh, as for your Mr Weasly you may proceed into the great hall with Miss Patil.
RON	381	No. Absolutely not.  Loud music plays as the champions head to the dancefloor with
PARVATI	382	Harry. Take my waist.
HARRY	383	What?
PARVATI	384	Now.
